{
  "schema_version": "0.1",
  "profile_id": "unknown-private-capture",
  "description": "Conservative analysis of an unknown private TCP capture. M01 reassembles TCP directions, then the longest complete direction is framed without truth labels.",
  "stages": ["M01", "M02", "M03", "M04", "M05", "M06", "M09", "M10", "M12"],
  "structure": {"source": "longest_m01_stream_direction", "rule": "infer", "rule_origin": "automatically_inferred", "parameters": {"max_header_size": 12, "max_frame_length": 1048576, "min_frames": 3}},
  "m02": {"window_size": 256, "window_step": 256},
  "m04": {"eps": 0.35, "min_samples": 2, "prefix_length": 1},
  "m12": {"max_evidence": 500},
  "limitations": ["Only the longest complete TCP direction is used for automatic structural inference in this profile.", "A capture without a complete reassembled TCP direction is reported as insufficient evidence.", "Clusters and fields are hypotheses, not confirmed protocol semantics."]
}
