{
  "schema_version": "0.1",
  "profile_id": "acceptance",
  "description": "Offline-reproducible ABC integration profile for C's frozen download-01 capture.",
  "stages": ["M01", "M02", "M03", "M04", "M05", "M06", "M07", "PAYLOAD_SOURCES", "M08", "M09", "M10", "M11", "M12"],
  "reuse": {
    "m01": "data/acceptance/frozen-20260910/integration/m01/result.json",
    "m07": "data/acceptance/frozen-20260910/full-chain/m07/protocols.json",
    "m11": "data/acceptance/frozen-20260910/full-chain/m11/classification.json"
  },
  "structure": {"source": "first_http_body", "rule": "fixed", "rule_origin": "protocol_declared", "parameters": {"start_offset": 0, "frame_size": "source_length"}},
  "classifier": {"evaluation": "data/acceptance/frozen-20260910/classification/model-run/evaluation.json"},
  "m02": {"window_size": 256, "window_step": 256}, "m12": {"max_evidence": 500}, "model": {"name": "deepseek-v4-flash"},
  "limitations": [
    "M01 and M07 are verified frozen TShark artifacts because this portable host has no TShark installation.",
    "The M03 fixed boundary is protocol-declared from the extracted HTTP body and is not presented as automatic unknown-format discovery.",
    "The controlled 18-capture classifier result is not a broad traffic-generalization claim."
  ]
}
