{
  "schema_version": "0.1",
  "profile_id": "course-capture-observability",
  "description": "Evidence-bound analysis of a supplied capture: content detection, packet/flow extraction, standard-protocol observations, traffic statistics, and conservative access-behavior candidates.",
  "stages": ["M01", "M02", "M07", "M09", "M10", "M12"],
  "m02": {"window_size": 256, "window_step": 256},
  "m12": {"max_evidence": 500},
  "limitations": [
    "Standard protocol recognition is performed only when the capture and dissector expose evidence.",
    "Traffic behavior candidates are not application semantics, user identities, or maliciousness labels.",
    "Encrypted payload plaintext is never claimed without explicit decryption material."
  ]
}
